{
  "contractVersion": "1",
  "jobId": "job:discovery-iowacity-001",
  "scheduleOccurrenceId": null,
  "kind": "city-source-discovery",
  "cityKey": "iowacity",
  "implementationRevision": "relay-worker@2026.09.08",
  "basedOnContextVersion": "ctx:iowacity.discovery.v3",
  "exportedAt": "2026-09-08T20:45:00.000Z",
  "outcome": "completed",
  "diagnostics": {
    "logs": [
      "Searching the web for Iowa City event sources",
      "example-theatre.org qualified with 9 event(s)"
    ],
    "steps": [
      {
        "at": "2026-09-08T20:05:00.000Z",
        "phase": "searching",
        "kind": "plan",
        "title": "Searching the web for Iowa City event sources",
        "detail": "8 queries seeded from the tag catalog",
        "host": null,
        "code": null
      }
    ],
    "memory": {
      "startedFreeBytes": 2147483648,
      "finishedFreeBytes": 1932735283,
      "totalBytes": 17179869184
    },
    "providerCalls": {
      "searches": 8,
      "maps": 3,
      "scrapes": 2,
      "nativeCrawls": 1
    },
    "internalRunId": "507f1f77bcf86cd799439099",
    "workerAttemptId": "attempt:001",
    "durationMs": 2700000
  }
}
